<?xml version="1.0" encoding="UTF-8" ?>

<!DOCTYPE localeData SYSTEM "./LocaleElements.dtd" >

<!-- 
	Copyright (C) 2000-2003, International Business Machines 
	Corporation and others.  All Rights Reserved.
 -->

<localeData>
	<versioning  >
 		<version number="1.0" date="Tue Jun 11 15:06:59 2002">Various notes and changes in version 1.0</version>
	</versioning  >
 	<identity  >
		<country id="LU" />
		<correspondsTo vendor="140C">Windows</correspondsTo>
	</identity  >
	<calendars>
		<calendar class="gregorian" default="true">
			<monthNames>
				<month id="1">janvier</month>
				<month id="2">février</month>
				<month id="3">mars</month>
				<month id="4">avril</month>
				<month id="5">mai</month>
				<month id="6">juin</month>
				<month id="7">juillet</month>
				<month id="8">août</month>
				<month id="9">septembre</month>
				<month id="10">octobre</month>
				<month id="11">novembre</month>
				<month id="12">décembre</month>
				<month id="13"></month>
			</monthNames>
			<dayNames>
				<day id="1">dimanche </day>
				<day id="2">lundi </day>
				<day id="3">mardi </day>
				<day id="4">mercredi </day>
				<day id="5">jeudi </day>
				<day id="6">vendredi </day>
				<day id="7">samedi </day>
			</dayNames>
			<dayAbbr>
				<day id="1">dim. </day>
				<day id="2">lun. </day>
				<day id="3">mar. </day>
				<day id="4">mer. </day>
				<day id="5">jeu. </day>
				<day id="6">ven. </day>
				<day id="7">sam. </day>
			</dayAbbr>
			<am></am><pm></pm>
			<patterns> 
				<time>
					<full></full>
					<long></long>
					<medium>HH:mm:ss</medium>
					<short></short>
				</time>
				<date>
					<full>dddd d MMMM yyyy</full>
					<long></long>
					<medium></medium>
					<short>dd/MM/yyyy</short>
				</date>
 				<dateTime> </dateTime>
			</patterns>
			<firstDay>0</firstDay>
			<minDays></minDays>
		</calendar>
	</calendars>
	<numberFormat class="decimal" default="true"> 
		<patterns> 
			<decimal></decimal>
			<percent></percent>
		</patterns>
		<symbols>
			<decimal>,</decimal>
			<group> </group>
			<list>;</list>
			<percentSign>%</percentSign>
			<nativeZeroDigit>;</nativeZeroDigit>
			<patternDigit>#</patternDigit>
			<plusSign>+</plusSign>
			<minusSign>-</minusSign>
			<exponential>E</exponential>
			<perMille>‰</perMille>
			<infinity>∞</infinity>
			<nan>�</nan>
		</symbols>
	</numberFormat> 
	<currencies>
		<currency id="LUF" default="true">
			<symbol>F</symbol>
			<name>LUF</name>
			<decimal>,</decimal>
			<pattern>#,##0.00 ¤;-#,##0.00 ¤</pattern>
		</currency>
	</currencies>

</localeData>
