<?xml version="1.0" encoding="UTF-8" ?>
<!--add CoreLocaleElements DTD reference here-->
<!-- Tag was "CoreLocaleData" - this has been changed below to allow the
Cupertino XML tool to work -->
<!DOCTYPE localeData SYSTEM "./LocaleElements.dtd" >
<localeData>
<generation date="2002, June, 12"></generation>
<!--
Core Locale Data Format
Version 1.0.4: 2002-05-23
	
Contains locale data elements from ICIR (version 1.4.1) that map into 
CoreLocaleElements.xml.
-->

<!--ICIR VERSION information-->
  <versioning>
    <version number="1.4.1"></version>
  </versioning>

<!--IDENTIFICATION of the locale-->
  <identity>
    <!--Two letter ISO codes only-->
    <language id="sq"/>
    <country id="AL"/>
  </identity>

<!--CALENDAR INFORMATION.  Gregorian Only-->
  <calendars>
    <calendar class="Gregorian" default="true">
      <monthNames>
        <month id="1">janar</month>
        <month id="2">shkurt</month>
        <month id="3">mars</month>
        <month id="4">prill</month>
        <month id="5">maj</month>
        <month id="6">qershor</month>
        <month id="7">korrik</month>
        <month id="8">gusht</month>
        <month id="9">shtator</month>
        <month id="10">tetor</month>
        <month id="11">n&#x00eb;ntor</month>
        <month id="12">dhjetor</month>
        <month id="13"></month>
      </monthNames>

      <monthAbbr>
        <month id="1">Jan</month>
        <month id="2">Shk</month>
        <month id="3">Mar</month>
        <month id="4">Pri</month>
        <month id="5">Maj</month>
        <month id="6">Qer</month>
        <month id="7">Kor</month>
        <month id="8">Gsh</month>
        <month id="9">Sht</month>
        <month id="10">Tet</month>
        <month id="11">N&#x00eb;n</month>
        <month id="12">Dhj</month>
        <month id="13"></month>
      </monthAbbr>

      <dayNames>
        <day id="1">e diel&#x00eb;</day>
        <day id="2">e h&#x00eb;n&#x00eb;</day>
        <day id="3">e mart&#x00eb;</day>
        <day id="4">e m&#x00eb;rkur&#x00eb;</day>
        <day id="5">e enjte</day>
        <day id="6">e premte</day>
        <day id="7">e shtun&#x00eb;</day>
      </dayNames>

      <dayAbbr>
        <day id="1">Die</day>
        <day id="2">H&#x00eb;n</day>
        <day id="3">Mar</day>
        <day id="4">M&#x00eb;r</day>
        <day id="5">Enj</day>
        <day id="6">Pre</day>
        <day id="7">Sht</day>
      </dayAbbr>

      <!--
      Patterns used for formatting and parsing dates and times for this calendar
      -->

      <patterns>
        <!-- <chars>GyMdhHmsSEDFwWakKz</chars> -->
        <time>
          <full>HH:mm:ss</full>
          <medium>HH:mm:ss</medium>
          <short>HH:mm</short>
        </time>

        <date>
          <full>EEEE, dd MMMM yyyy</full>
          <long>dd MMMM yyyy</long>
          <short>dd-MM-yy</short>
        </date>
      </patterns>
    </calendar>
  </calendars>

<!--NUMERIC INFORMATION-->
  <numberFormat class="decimal" default="true">
    <patterns>
      <decimal>#,###,##0.##;-#,###,##0.##</decimal>
    </patterns>
    <symbols>
      <decimal>,</decimal>
      <group>.</group>
      <minusSign>-</minusSign>
    </symbols>
  </numberFormat>

<!--MONETARY INFORMATION-->
  <currencies>
    <!--currency id as per ISO4217, three letter alphabetic code-->
    <currency id="ALL">
      <symbol>Lek</symbol>
      <pattern>&#x00A4;#,###,##0.00;-&#x00A4;#,###,##0.00</pattern>
      <decimal>,</decimal>
      <group>.</group>
    </currency>
  </currencies>

<!--POSIX TYPE INFORMATION-->
  <PosixCompatibilityData>
    <!--POSIX LC_MESSAGE EQUIVALENT-->
    <messages>
      <no>JO</no>
      <yes>PO</yes>
      <shortNo>JO</shortNo>
      <shortYes>PO</shortYes>
    </messages>

    <!--TELEPHONE INFORMATION-->
    <TelephoneFormat>
      <!-- International Access Code is shown below -->
      <InternationalDialCode>00</InternationalDialCode>
    </TelephoneFormat>
  </PosixCompatibilityData>

<!-- Tag was "/CoreLocaleData" - changed below to allow Cupertino XML
tool to work -->
</localeData>
