<?xml version="1.0" encoding="UTF-8" ?>

<!DOCTYPE localeData SYSTEM "./LocaleElements.dtd" >

<!-- 
	Copyright (C) 2000-2003, International Business Machines 
	Corporation and others.  All Rights Reserved.
 -->

<localeData>
	<versioning  >
 		<version number="1.0" date="Thu Jun 13 16:05:09 2002">Various notes and changes in version 1.0</version>
	</versioning  >
 	<identity  >
		<country id="CA" />
		<correspondsTo vendor="0c0c">Windows</correspondsTo>
	</identity  >

	<displayNames >
		<countries  >
			<country id="US">Ã‰tats-Unis</country>
		</countries  >

	</displayNames >
	<calendars>
		<calendar class="gregorian" default="true">
			<patterns> 
				<chars>GanjkHmsSEDFwWxhKzZ</chars>
				<time>
					<full>H' h 'mm z</full>
					<long>HH:mm:ss z</long>
					<medium>HH:mm:ss</medium>
					<short>HH:mm</short>
				</time>
				<date>
					<full>EEEE d MMMM yyyy</full>
					<long>d MMMM yyyy</long>
					<medium>yyyy-MM-dd</medium>
					<short>yy-MM-dd</short>
				</date>
 				<dateTime>{1} {0} </dateTime>
			</patterns>
		</calendar>
	</calendars>
	<numberFormat class="decimal" default="true"> 
		<patterns> 
			<decimal>#,##0.###;-#,##0.###</decimal>
			<percent>#,##0%</percent>
		</patterns>
	</numberFormat> 

</localeData>
