<?xml version="1.0" encoding="UTF-8" ?>
<!--add CoreLocaleElements DTD reference here-->
<!-- Tag was "CoreLocaleData" - this has been changed below to allow the
Cupertino XML tool to work -->
<!DOCTYPE localeData SYSTEM "./LocaleElements.dtd" >
<localeData>
<generation date="2002, June, 12"></generation>
<!--
Core Locale Data Format
Version 1.0.4: 2002-05-23
	
Contains locale data elements from ICIR (version 1.4.1) that map into 
CoreLocaleElements.xml.
-->

<!--ICIR VERSION information-->
  <versioning>
    <version number="1.4.1"></version>
  </versioning>

<!--IDENTIFICATION of the locale-->
  <identity>
    <!--Two letter ISO codes only-->
    <language id="de"/>
    <country id="CH"/>
  </identity>

<!--CALENDAR INFORMATION.  Gregorian Only-->
  <calendars>
    <calendar class="Gregorian" default="true">
      <monthNames>
        <month id="1">Januar</month>
        <month id="2">Februar</month>
        <month id="3">M&#x00e4;rz</month>
        <month id="4">April</month>
        <month id="5">Mai</month>
        <month id="6">Juni</month>
        <month id="7">Juli</month>
        <month id="8">August</month>
        <month id="9">September</month>
        <month id="10">Oktober</month>
        <month id="11">November</month>
        <month id="12">Dezember</month>
        <month id="13"></month>
      </monthNames>

      <monthAbbr>
        <month id="1">Jan</month>
        <month id="2">Feb</month>
        <month id="3">M&#x00e4;r</month>
        <month id="4">Apr</month>
        <month id="5">Mai</month>
        <month id="6">Jun</month>
        <month id="7">Jul</month>
        <month id="8">Aug</month>
        <month id="9">Sep</month>
        <month id="10">Okt</month>
        <month id="11">Nov</month>
        <month id="12">Dez</month>
        <month id="13"></month>
      </monthAbbr>

      <dayNames>
        <day id="1">Sonntag</day>
        <day id="2">Montag</day>
        <day id="3">Dienstag</day>
        <day id="4">Mittwoch</day>
        <day id="5">Donnerstag</day>
        <day id="6">Freitag</day>
        <day id="7">Samstag</day>
      </dayNames>

      <dayAbbr>
        <day id="1">So</day>
        <day id="2">Mo</day>
        <day id="3">Di</day>
        <day id="4">Mi</day>
        <day id="5">Do</day>
        <day id="6">Fr</day>
        <day id="7">Sa</day>
      </dayAbbr>

      <!--
      Patterns used for formatting and parsing dates and times for this calendar
      -->

      <patterns>
        <!-- <chars>GyMdhHmsSEDFwWakKz</chars> -->
        <time>
          <full>H:m:s z</full>
          <medium>H:m:s </medium>
          <short>H:m</short>
        </time>

        <date>
          <full>EEEE, d. MMMM yyyy</full>
          <long>d. MMMM yyyy</long>
          <short>dd.MM.yy</short>
        </date>
      </patterns>
    </calendar>
  </calendars>

<!--NUMERIC INFORMATION-->
  <numberFormat class="decimal" default="true">
    <patterns>
      <decimal>#,###,##0.##;-#,###,##0.##</decimal>
    </patterns>
    <symbols>
      <decimal>,</decimal>
      <group>'</group>
      <minusSign>-</minusSign>
    </symbols>
  </numberFormat>

<!--MONETARY INFORMATION-->
  <currencies>
    <!--currency id as per ISO4217, three letter alphabetic code-->
    <currency id="CHF">
      <symbol>CHF</symbol>
      <pattern>&#x00A4; #,###,##0.00;&#x00A4; -#,###,##0.00</pattern>
      <decimal>.</decimal>
      <group>'</group>
    </currency>
  </currencies>

<!--POSIX TYPE INFORMATION-->
  <PosixCompatibilityData>
    <!--POSIX LC_MESSAGE EQUIVALENT-->
    <messages>
      <no>Nein</no>
      <yes>Ja</yes>
      <shortNo>N</shortNo>
      <shortYes>J</shortYes>
    </messages>

    <!--TELEPHONE INFORMATION-->
    <TelephoneFormat>
      <!-- International Access Code is shown below -->
      <InternationalDialCode>00</InternationalDialCode>
    </TelephoneFormat>
  </PosixCompatibilityData>

<!-- Tag was "/CoreLocaleData" - changed below to allow Cupertino XML
tool to work -->
</localeData>
