<?xml version="1.0" encoding="UTF-8" ?>

<!DOCTYPE localeData SYSTEM "./LocaleElements.dtd" >

<!-- 
	Copyright (C) 2000-2003, International Business Machines 
	Corporation and others.  All Rights Reserved.
 -->

<localeData>
	<versioning  >
 		<version number="1.0" date="Thu Jun 13 16:04:27 2002">Various notes and changes in version 1.0</version>
	</versioning  >
 	<identity  >
		<country id="CH" />
		<correspondsTo vendor="0810">Windows</correspondsTo>
	</identity  >
	<timeZoneNames>
		<zone id="Africa/Casablanca" default="true">
			<long>
				<generic>GMT</generic>
				<standard>GMT</standard>
			</long>
			<short>
				<generic>Africa/Casablanca</generic>
				<standard>GMT</standard>
				<daylight>GMT</daylight>
			</short>
		</zone>
	</timeZoneNames>
	<calendars>
		<calendar class="gregorian" default="true">
			<patterns> 
				<chars>GuMtkHmsSEDFwWahKz</chars>
				<time>
					<full>H.mm' h' z</full>
					<long>HH:mm:ss z</long>
					<medium>HH:mm:ss</medium>
					<short>HH:mm</short>
				</time>
				<date>
					<full>EEEE, d. MMMM yyyy</full>
					<long>d. MMMM yyyy</long>
					<medium>d-MMM-yy</medium>
					<short>dd.MM.yy</short>
				</date>
 				<dateTime>{1} {0} </dateTime>
			</patterns>
		</calendar>
	</calendars>
	<numberFormat class="decimal" default="true"> 
		<patterns> 
			<decimal>#,##0.###;-#,##0.###</decimal>
			<percent>#,##0%</percent>
		</patterns>
		<symbols>
			<decimal>.</decimal>
			<group>'</group>
			<list>;</list>
			<percentSign>%</percentSign>
			<nativeZeroDigit>0</nativeZeroDigit>
			<patternDigit>#</patternDigit>
			<plusSign>+</plusSign>
			<minusSign>-</minusSign>
			<exponential>E</exponential>
			<perMille>‰</perMille>
			<infinity>∞</infinity>
			<nan>�</nan>
		</symbols>
	</numberFormat> 
	<currencies>
		<currency id="CHF" default="true">
			<symbol>SFr.</symbol>
			<name>CHF</name>
			<decimal>.</decimal>
			<pattern>¤ #,##0.00;¤-#,##0.00</pattern>
		</currency>
	</currencies>

</localeData>
